timestamp,title,text,link,scam
2023-06-02,Justin Sun Predicts Huobi May Get Hong Kong License in 6 to ...,"Crypto exchange Huobi could receive a crypto trading license in Hong Kong as ... When asked about possibly competing with Coinbase and Kraken in Canada, Sun...",https://www.coindesk.com/business/2023/06/02/huobi-could-have-hong-kong-license-in-six-to-twelve-months-justin-sun-on-coindesk-tv/,
2023-05-12,Binance.US seeking ways to cut Changpeng Zhao's majority ...,"He is also the CEO and co-founder of the global crypto exchange, Binance. 4394 ... Other major exchanges such as Kraken and Bittrex have already fully or...",https://cointelegraph.com/news/binance-us-seeking-to-cut-changpeng-zhao-s-majority-stake-report,
2023-05-19,"'So Much Anger, So Much Hate', Says Ledger Co-Founder Amid Botched Recover Service Launch",In February the U.S. Securities and Exchange Commission hit American crypto exchange Kraken with a $30 million fine for allegedly failing to register the...,https://decrypt.co/140692/so-much-anger-so-much-hate-says-ledger-co-founder-amid-botched-recover-service-launch,
2023-06-09,US House committee releases new stablecoin bill draft,"Nifty News: Kraken NFT exits beta, Coinbase's 'Stand with Crypto' gains support, and more. A Bitcoin inscription service aims to compete with Ordinals by...",https://cointelegraph.com/news/us-house-committee-releases-new-stablecoin-bill-draft,
2023-05-30,"Binance's CZ dispels FUD, speculates on next big crypto trend ...","He said that companies like Coinbase and Kraken are working together with ... Morgan Stanley believes crypto winter is over, Bitcoin halving will kick off new...",https://cryptoslate.com/binances-cz-dispels-fud-speculates-on-next-big-crypto-trend-in-new-interview/,
2023-05-12,Crypto Firm Bakkt Delists Tokens as Regulatory Pressures ...,"... crypto companies scrap products for U.S. customers and launch new offerings overseas. In February, crypto exchange Kraken shut down its staking services in...",https://www.theinformation.com/articles/crypto-firm-bakkt-delists-tokens-as-regulatory-pressures-mount,
2023-05-30,Binance Australia blames AUD liquidity drop for Bitcoin discount,"A spokesperson for the crypto exchange ... This is significantly lower than what it is trading on other exchanges like IndependentReserve, Luno, and Kraken,...",https://cryptoslate.com/binance-australia-blames-aud-liquidity-drop-for-bitcoin-discount/,
2023-05-17,SEC warns that Filecoin 'meets definition of a security ...,... crypto exchanges. On Feb. 9 the SEC fined U.S.-based crypto exchange Kraken for “selling unregistered securities” and ordered the exchange to shut down its...,https://cointelegraph.com/news/sec-filecoin-is-security-grayscale-investors,
2023-05-16,Crucial questions every journalist should ask when covering ...,"... exchange, arrives to the Manhattan federal court in New York ... Crypto companies and (seemingly solvent) crypto exchanges from Binance to Kraken do the same.",https://reutersinstitute.politics.ox.ac.uk/crucial-questions-every-journalist-should-ask-when-covering-crypto,
2023-05-25,"German banks slowly adopt crypto, mostly for institutional ...","... crypto exchanges Bitcoin Deutschland and Kraken. Hamburg-based Sutor Bank is also starting to make its mark on the crypto scene, partnering with startups...",https://cointelegraph.com/news/german-banks-slowly-adopt-crypto-mostly-for-institutional-investors,
2023-05-11,10T Co-Founder Wants to Build New $200 Million Fund,"10T Holdings invested in companies like digital asset exchange Kraken, crypto wallet-maker Ledger and the Bored Ape Yacht Club-creator Yuga Labs. Kraken is...",https://www.bloomberg.com/news/articles/2023-05-11/crypto-vcs-behind-10t-want-to-build-new-200-million-fund,
2023-05-11,How Valuations of IPO Hopefuls Have Plunged From ...,"Kraken, another crypto exchange, had been valued at $10.8 billion in February 2022. The San Francisco company cut 30% of its workforce in November. It also...",https://www.theinformation.com/articles/how-valuations-of-ipo-hopefuls-have-plunged-from-pandemic-era-heights,
2023-05-11,Issuers Rush to 'Piggyback' on Grayscale Ether Futures ETF ...,"... bitcoin ETPs trading outside the US, as well as bitcoin miners. Grayscale is ... crypto exchange with two charges related to its staking products. Though Kraken...",https://blockworks.co/news/issuers-piggyback-on-grayscale-proposal,
2023-06-11,What investors want to know about the SEC's crypto crackdown,... crypto exchanges that allowed investors to trade the tokens at issue. Some exchanges have already been a target of the SEC. US crypto currency exchange Kraken...,https://finance.yahoo.com/news/what-investors-want-to-know-about-the-secs-crypto-crackdown-145233484.html,
2023-05-10,Regulatory Clarity for Crypto Marketplaces Part II: Centralized ...,"To maintain registration as a crypto commodity exchange, such exchange shall ... Peirce, “Kraken Down: Statement on SEC v. Payward Ventures, Inc., et al...",https://www.cato.org/briefing-paper/regulatory-clarity-crypto-marketplaces-part-ii-centralized-exchanges,
2023-06-05,Crypto use in Russia rises as country faces sanctions and ...,"... crypto exchanges, including Binance, Kraken, Bybit, Okcoin, and Bittrex. Attacks from Ukraine have turned Russians toward crypto. The use of crypto in Russia...",https://protos.com/crypto-use-in-russia-rises-as-country-faces-sanctions-and-bank-outages/,
2023-06-01,Sui Creator Mysten Labs Inks F1 Sponsorship Deal With Red Bull Racing,... crypto exchange Kraken as a sponsor this past March. Stay on top of crypto ... Cryptocurrency exchange Coinbase is prepared to move quickly if a spot Bitcoin...,https://decrypt.co/143066/sui-creator-mysten-labs-inks-f1-sponsorship-deal-red-bull-racing,
2023-06-11,Bitcoin discounted on Binance.US after fiat withdrawal halt news,"... Bitcoin on Binance's American arm was slightly lower than on Kraken and Coinbase. However, Bitcoin had returned to trading at a premium on Binance.US. The BTC...",https://www.tradingpedia.com/2023/06/11/bitcoin-discounted-on-binance-us-after-fiat-withdrawal-halt-news/,
2023-05-31,Kraken Named in Newsweek's Top 100 Global Most Loved ...,"Kraken was also the only crypto company to be included in Newsweek's list. This ... RSS feed for Kraken Digital Asset Exchange. October 05, 2023. Kraken to...",https://www.businesswire.com/news/home/20230531005940/en/Kraken-Named-in-Newsweek%E2%80%99s-Top-100-Global-Most-Loved-Workplaces,
2023-05-30,Ripple fans push up XRP price as conclusion in case against SEC draws closer,"Unlike other crypto companies such as Kraken and BlockFi, Ripple chose to go to court instead of settling with the SEC. In doing so, the company has...",https://finance.yahoo.com/news/ripple-fans-push-xrp-price-161456693.html,+
2023-05-12,Perpetual Futures in Crypto Guide & Top Exchanges for Trading Crypto Perpetual Contracts,"Kraken Futures supports cryptocurrencies such as Bitcoin, Ethereum, and Litecoin. ... How do I choose the best exchange for trading crypto perpetual contracts?",https://finance.yahoo.com/news/perpetual-futures-crypto-guide-top-172503506.html,+
2023-05-18,Coinbase Faces Temporary Glitch in ETH Staking Rewards ...,"... crypto payouts. An advantage of Coinbase's staking service is the lack of a ... Earlier this year, Kraken, another exchange, was hit with a $30 million fine...",https://tokenpost.com/Ethereum-Staking-Payouts-Temporarily-Suspended-on-Coinbase-for-72-Hours-10055,
2023-05-15,"Bitcoin is a bubble with 'no inherent value and is terribly overpriced,' top economist Steve Hanke says",The Securities and Exchange Commission and other watchdogs have cracked down on major crypto exchanges including Binance and Kraken. The collapse of crypto...,https://ca.finance.yahoo.com/news/bitcoin-bubble-no-inherent-value-145219424.html,+
2023-05-15,Only half of top 60 crypto companies have an external auditor,"This includes exchanges Crypto.com and Kraken, non-fungible tokens (NFTs) ... cryptocurrency exchange that provides a platform for trading more than 100...",https://cryptoslate.com/only-half-of-top-60-crypto-companies-have-an-external-auditor/,
2023-05-17,Binance's share of Bitcoin spot market falls more than half ...,"Around this time, several CEXs also came under regulatory actions, including Kraken — which, in February, agreed to a $30 million settlement with the Securities...",https://cryptoslate.com/binances-share-of-bitcoin-spot-market-falls-more-than-half-since-february-peak-of-85/,
2023-06-08,How will the UK's crypto crackdown work? | ITV News,Examples of NFTs marketed by crypto exchange Kraken. ... The term 'crypto asset' covers digital coins like Bitcoin and products like NFTs.,https://www.itv.com/news/2023-06-08/how-will-the-uks-crypto-crackdown-work,
2023-06-09,New UK Crypto Investors Face ‘Cooling-Off Period’ Under FCA Rules,"Cryptocurrency exchange Coinbase is prepared to move quickly if a spot Bitcoin ... crypto exchanges Coinbase, Bittrex, and Kraken. Only days ago, Gensler said...",https://decrypt.co/143810/new-uk-crypto-investors-face-cooling-off-period-under-fca-rules,
2023-05-29,"Bitcoin Touches $28,000 as U.S. Debt Ceiling Deal Heads to Congress","... exchange, confirms that a significant portion of the decline came from FTX. An exodus followed shortly across other major exchanges such as Binance, Kraken...",https://decrypt.co/142712/bitcoin-touches-28000-as-u-s-debt-ceiling-deal-heads-to-congress,+
2023-06-06,Crypto's Future After The Storm: Fintech 50 2023,"Cofounders: CEO Michael Gronager, 52, a PhD in quantum mechanics who cofounded cryptocurrency exchange Kraken before leaving in 2015 to launch Chainalysis...",https://www.forbes.com/sites/ninabambysheva/2023/06/06/cryptos-future-after-the-storm-fintech-50-2023/,
2023-05-17,Deblock quietly raises €12m for non-custodial crypto wallet,"Meyer is the group CEO. Deblock quietly raised a €12m seed round in October from Harry Stebbings' firm 20VC, Headline, Hoxton Ventures, Kima Ventures and Kraken...",https://sifted.eu/articles/revolut-ledger-alumni-stealth-crypto-deblock-news,
2023-06-08,“We've Seen This Story Before” Remarks before the Piper ...,... exchange for investors' crypto tokens. They have many names for their ... See also “Kraken to Discontinue Unregistered Offer and Sale of Crypto Asset...,https://www.sec.gov/news/speech/gensler-remarks-piper-sandler-060823,+
2023-06-12,"Pro-Crypto Lawmakers Officially Introduce Legislation To Oust SEC Chair, Gary Gensler",Davidson slammed the SEC's regulation-by-enforcement technique when it fined Kraken $30 million and forced the exchange to close its staking program in the U.S...,https://zycrypto.com/pro-crypto-lawmakers-officially-introduce-legislation-to-oust-sec-chair-gary-gensler/,
2023-05-16,The Flight to Quality: Compliance Will Be Key for Exchanges ...,"In the United States, the Securities and Exchange Commission (SEC) has issued a Wells Notice to Coinbase, fined Kraken ... crypto exchange. In the wake of the...",https://blockworks.co/news/compliance-key-for-exchanges,
2023-05-23,Bitget Continues European Expansion with Polish Registration,"Kraken, a US-based crypto exchange, recently secured a similar registration in Ireland despite facing regulatory headwinds in the United States. In fact,...",https://www.financemagnates.com/cryptocurrency/bitget-continues-european-expansion-with-polish-registration/,
2023-05-17,Ten Best Crypto Brokers for 2023,Users can also trade on the Kraken Pro platform with lower fees that vary ... Coinbase– Coinbase is a US-based crypto exchange that offers trading in over 200...,https://www.analyticsinsight.net/ten-best-crypto-brokers-for-2023/,
2023-05-16,EU Countries OK World's First Comprehensive Crypto Rules,"The Securities and Exchange Commission (SEC) has gone after several key players in the sector, including Terra, Coinbase, Kraken ... Crypto Spot Trading Falls 40%...",https://www.pymnts.com/cryptocurrency/2023/european-union-ok-world-first-comprehensive-crypto-rules/,
2023-06-10,"Report Suggests 1,000 XRP Could Make You $3.5 Million","Most prominent US-based exchanges, such as Coinbase and Kraken, had to delist XRP. ... Crypto News. Crypto News · Crypto Exchange News · Crypto Analysis · Bitcoin...",https://thecryptobasic.com/2023/06/10/report-suggests-1000-xrp-could-make-you-3-5-million/,
2023-05-10,Ethereum derivatives flirting with bearishness: Mind the ...,"... Kraken cryptocurrency exchange. The foundation's last relevant transfer occurred in November 2021, when the price topped around $4,850 and subsequently...",https://cointelegraph.com/news/ethereum-derivatives-flirting-with-bearishness-mind-the-1-820-support,
2023-05-24,Trezor Sales Spike 900% Even as Exploit of “T” Model is ...,"Sales of hardware wallet Trezor jumped after rival Ledger proposed a feature that has unnerved crypto holders. ... Kraken, a crypto exchange, had already released...",https://thedefiant.io/trezor-sales-spike,
2023-05-12,From DOGE to PEPE: The evolution of memecoins and the ...,"TradeSanta has partnered with centralized exchanges like Binance, Huobi, Bybit, Coinbase, OKX and Kraken, giving its users access to optimal-performing...",https://cointelegraph.com/news/from-doge-to-pepe-the-evolution-of-memecoins-and-the-search-for-substance-in-the-crypto-industry,
2023-06-09,World's Top Crypto Exchanges The Rich Should Know,"Very much like Binance, Kraken ranks highly when it comes to security. Coinbase. Coinbase is an American crypto exchange that was founded in the year 2012. Last...",https://ceoworld.biz/2023/06/09/worlds-top-crypto-exchanges-the-rich-should-know/,
2023-06-12,Top Crypto Exchange Volumes Start to Slide Amid SEC ...,"According to CoinMarketCap, crypto exchange trading volume for the top nine ... Kraken, Bitstamp, and Bitfinex Volumes had slumped by more than 50%.",https://beincrypto.com/crypto-exchange-trading-volumes-slashed/,
2023-05-23,The race is on for the Web3 hub of Asia,"... crypto exchange Kraken and shut its crypto staking program. In April, the ... But cryptocurrencies and crypto exchanges are just one part of the entire...",https://forkast.news/the-race-is-on-for-the-web3-hub-of-asia/,
2023-05-26,F1 Ticket Provider Platinum Group Introduces NFT Tickets for Global Racing Event,"In June 2021, digital asset exchange Crypto.com penned a ... In March, digital asset brokerage Kraken signed a sponsorship deal with the Williams Racing team.",https://finance.yahoo.com/news/f1-ticket-provider-platinum-group-110000154.html,
2023-05-23,How to Buy Bitcoin With a Credit Card in 2023,"Best Bitcoin Exchanges. Company, Transaction Fees, Currencies, Minimum Deposit or Purchase, Trade Limits. Kraken, 0.00% to 0.26%, 185+, $1, No. Coinbase, 0.00%...",https://www.investopedia.com/how-to-buy-bitcoin-with-a-credit-card-7500941,
2023-05-23,Prometheum becomes first crypto company to be approved by ...,Coinbase · Ripple · VanEck · Kraken · BlackRock · FTX...,https://cryptoslate.com/prometheum-becomes-first-crypto-company-to-secure-sec-finra-approval/,
2023-05-23,How to Create a Crypto Wallet in 2023,"Best Cryptocurrency Exchanges. Company, Transaction Fees, Currencies, Minimum Deposit or Purchase, Trade Limits. Kraken, 0.00% to 0.26%, 185+, $1, No. Coinbase...",https://www.investopedia.com/how-to-create-a-crypto-wallet-7500574,
2023-05-24,Mark Cuban Believes SECs Attack On Crypto Tokens Won't Work,"The US Securities and Exchange Commission is on a roll to label crypto tokens ... SEC has already targeted crypto exchanges Kraken, Bittrex, and Coinbase for...",https://coingape.com/billionaire-mark-cuban-believes-secs-attack-on-crypto-tokens-wont-work/,
2023-05-25,Analysts Say Buy Bitcoin Cash and Tradecurve for Future Growth,"Tradecurve is a hybrid exchange that enables users to trade derivatives alongside cryptocurrencies. However, unlike centralized exchanges like Kraken, and...",https://coinpedia.org/press-release/analysts-say-buy-bitcoin-cash-and-tradecurve-for-future-growth/,
2023-05-10,Top 10 Crypto Fintech Companies for 2023,Kraken: A popular cryptocurrency exchange offering trading services for over 50 cryptocurrencies. Gemini: A regulated cryptocurrency exchange and custodian...,https://www.analyticsinsight.net/top-10-crypto-fintech-companies-for-2023/,
2023-05-23,Binance slowly being squeezed out of Australia | Information ...,"Binance's cryptocurrency exchange competitors have taken advantage of Binance being excised from certain banks and payment protocols. On Twitter, Kraken has...",https://ia.acs.org.au/article/2023/binance-is-slowly-being-squeezed-out-of-australia.html,
2023-05-21,Presidential Candidate Kennedy Vows to Defend Bitcoin Against ‘Invasive Surveillance’,... Kraken's staking platform and its proposal to amend the definition of “exchange” to bring crypto companies into its jurisdiction. XRP. +15.03%$0.6120. 24H...,https://decrypt.co/140847/robert-f-kennedy-jr-bitcoin-cbdc-energy-tax,
2023-06-05,Bitcoin dips below $27k in red market,"FLEX is the coin that powers CoinFLEX, a physically settled futures exchange. ... Kraken to turn over select customer data to IRS after July court loss. The...",https://cryptoslate.com/bitcoin-dips-below-27k-in-red-market-cryptoslate-wmarket-update/,
2023-05-31,Cuba Bitcoin community hosts BTC-only meetup,"... exchanges such as Coinbase, Kraken and Gemini are not welcome in Cuba. As a result, Cubans tend to buy Bitcoin the OG way, through peer-to-peer exchange.",https://cointelegraph.com/news/cuba-bitcoin-community-hosts-btc-only-meetup,
2023-05-16,'Trusted' marketplace sold fake Trezor wallets stealing crypto ...,"... Bitcoin payments. River was an early adopter of the Lightning Network, similar to global crypto exchanges like Bitfinex and Kraken. A snapshot of the River...",https://cointelegraph.com/news/trusted-seller-vends-fake-trezor-wallets-stealing-crypto-kaspersky,+
2023-06-01,The (somewhat lively) state of crypto regulation,"... cryptocurrencies, digital assets, or blockchain. Banking regulators. Fed, FDIC ... Kraken) for illegally offering margined retail commodity transactions in...",https://www.thomsonreuters.com/en-us/posts/investigation-fraud-and-risk/crypto-regulation/,
2023-05-30,Mooney unveils bill to block central bank digital currency pilot program,Kraken Exchange chief legal officer Marco Santori and FOX Business' Charlie Gasparino discuss Washington being torn over cryptocurrency and digital asset...,https://www.foxbusiness.com/politics/mooney-unveils-bill-block-central-bank-digital-currency-pilot-program,
2023-05-30,All Methods To Convert Bitcoin To Fiat Currency,"... cryptocurrency exchanges in Europe, which has over 270 crypto assets to choose from. Other options include Binance, Coinbase, Kraken, etc. Bitcoin ATMs. Bitcoin...",https://nohoartsdistrict.com/all-methods-to-convert-bitcoin-to-fiat-currency/,
2023-05-09,How to send and receive payments on the Lightning Network,"The Lightning Network is gradually being adopted across the crypto community and service providers, including exchanges. Kraken was one of the first to...",https://cointelegraph.com/news/how-to-send-and-receive-payments-on-the-lightning-network,
2023-06-05,XRP Lawsuit: US SEC Action About Bill Hinman Before June 13,"Breaking: Ethereum Co-Founder Moves 22K ETH To Kraken, Crash Ahead? Top Crypto Presale 2023 · coingpe · Advertise here · coingpe. Recommended...",https://coingape.com/ripple-vs-sec-hinman-documents-xrp-lawsuit-june-13/,
2023-05-09,Crypto exchange OKX takes jab at Coinbase with new campaign,"Kraken in February was forced by the SEC to close its staking service—a major source of revenue. Binance, the world's largest crypto exchange, is facing its...",https://adage.com/article/digital-marketing-ad-tech-news/okx-takes-jab-coinbase-new-campaign/2492686,
2023-05-08,U.S. Exchanges List More Than a Dozen Cryptos the SEC ...,"and Kraken, then delisted XRP, making it unavailable to users. The SEC's use of enforcement to name particular cryptocurrencies as securities has fueled...",https://www.wsj.com/articles/u-s-exchanges-list-more-than-a-dozen-cryptos-the-sec-says-are-illegal-to-sell-6c323b4,
2023-06-05,Looming June FOMC meeting roils Bitcoin market,"Bitcoin's volatility in 2023 is at its lowest in over a decade Record-high inflows and outflows noticed on Kraken, large investors in play Potential Bitcoin...",https://cryptoslate.com/insights/looming-june-fomc-meeting-roils-bitcoin-market/,
2023-05-10,UK tax authorities to be granted power to seize Bitcoin held on ...,"... exchanges like Coinbase, Binance, and Kraken may be subject to the regulations. When they find evidence of illegal conduct, law enforcement authorities now...",https://finbold.com/uk-tax-authorities-to-be-granted-power-to-seize-bitcoin-held-on-exchanges/,+
2023-06-10,"Binance CEO Clears Air on 'FUD,' Addresses Crypto Market ...","Top 5 Crypto ... One whale transferred over 5700,000 SOL worth $8.2 million to Binance, Kraken, and Coinbase.",https://beincrypto.com/binance-cz-crypto-market-crash/,
2023-06-05,Crypto Billionaire Changpeng Zhao in Hot Water,"As a crypto exchange, FTX executed orders ... The federal regulator recently launched lawsuits against many players, including Kraken but Binance is a big fish.",https://www.thestreet.com/crypto/news/crypto-billionaire-changpeng-zhao-in-hot-water,+
2023-05-17,"Celeb-backed Token Offerings More Likely to Be a Scam, Research Reports",U.S. crypto exchange Coinbase has launched a defense of its staking services ... It comes after the SEC hit rival exchange Kraken with a $30 million fine for...,https://decrypt.co/140418/celeb-backed-token-offerings-more-likely-be-scam-research-reports,
2023-05-26,Binance Expects to Launch New Thai Crypto Exchange in Q4 2023,"Amid a wave of wider crackdowns on cryptocurrency companies in the U.S., which also targeted rival companies Kraken and Coinbase, the Securities and Exchange...",https://decrypt.co/142511/binance-expectslaunch-new-thai-crypto-exchange-q4-2023,
2023-05-24,"3 Winning Cryptocurrencies: Dogecoin (DOGE), Tradecurve ...","Tradecurve provides crypto investors with a combination of traditional and decentralized trading ... Coinbase and Kraken, investors believe the project has huge...",https://www.analyticsinsight.net/3-winning-cryptocurrencies-dogecoin-doge-tradecurve-and-shiba-inu/,
2023-05-17,"Best Crypto Strategies in 2023: Mining, Staking, or Trading?","Crypto trading refers to the buying and selling of cryptocurrencies to ... Some popular cryptocurrency exchanges include Binance, Coinbase, Kraken, and Bitfinex.",https://www.cryptotimes.io/best-crypto-strategies-mining-staking-trading/,
2023-06-09,Is Tether (USDT) the Next Target of the SEC?,"... crypto exchanges Kraken and Bittrex, as well as crypto lending platform Nexo. ... cryptocurrency exchange, and Coinbase, the largest US-based cryptocurrency. The...",https://tokenist.com/is-tether-usdt-the-next-target-of-the-sec/,
2023-05-31,Trading volumes on CEXs and DEXs surge amid market ...,"Meanwhile, Kraken, America's second-largest exchange, has witnessed a 66.40 ... Uniswap V3 (Ethereum), the largest decentralized exchange, has seen a 47.61...",https://crypto.news/trading-volumes-on-cexs-and-dexs-surge-amid-market-downtrend/,+
2023-05-18,Ripple CEO: More Crypto Firms to Leave US amid Confusing Rules,"It has targeted even some of the top players such as Binance, Coinbase, and Kraken. As a result, several crypto firms have already initiated actions to set up...",https://www.coinspeaker.com/ripple-ceo-crypto-firms-us-rules/,
2023-05-11,"Bitcoin congestion issues continue amid BRC-20 memecoin, Ordinals surge","The Bitcoin blockchain ... NFT supporters, including Washington Sanchez, the NFT product lead at U.S.-based cryptocurrency exchange Kraken, brushed off Dashjr's...",https://forkast.news/bitcoin-congestion-issues-continue-brc-20-memecoin-ordinals-surge/,+
2023-06-09,Top 5 Crypto Exchanges Used In Canada,"Kraken is a US-based crypto exchange that has gained popularity among ... trading in over 100 cryptocurrencies, including Bitcoin, Ethereum, and Binance Coin.",https://macsources.com/top-5-crypto-exchanges-used-in-canada/,
2023-05-19,"MicroStrategy Looking at Bitcoin Ordinals for App Development, Says Michael Saylor","Solana Drops 5% as FTX-Linked Address Moves SOL to Kraken, Binance. After ... Cryptocurrency exchange Coinbase said it's prepared to move quickly if a spot...",https://decrypt.co/140670/microstrategy-looking-at-bitcoin-ordinals-for-app-development-says-michael-saylor,
2023-05-24,'Chinese Ethereum' Conflux Draws Spotlight as Hong Kong ...,"Kraken Incoming CEO on Company Culture, Future Plans as Jesse Powell Steps Down ... crypto exchange BTSE, told CoinDesk in a Telegram message. “Plus, today we...",https://www.coindesk.com/markets/2023/05/24/chinese-ethereum-conflux-draws-spotlight-as-hong-kong-welcomes-retail-traders/,
2023-05-20,Meme Tokens and NFTs Took Over Bitcoin—Now It's Happening on Dogecoin and Litecoin,"... Bitcoin community—has created a new wave of experimentation with crypto's oldest coin. ... Solana Drops 5% as FTX-Linked Address Moves SOL to Kraken, Binance.",https://decrypt.co/140683/meme-tokens-nfts-took-over-bitcoin-now-happening-dogecoin-litecoin,
2023-06-01,3 Critical Concerns When Crypto Trading in June 2023,"Contrarily, this decline has favored exchanges in the other categories, which comprises platforms such as Huobi, Kraken, and Kucoin. Crypto Market Share.",https://beincrypto.com/biggest-problems-crypto-trading-june/,
2023-05-18,"Hyperbitcoinization coming, says Bitcoin OG as 'wholecoiners ...",That could be achieved if Congress recognizes the inherent differences between digital assets that are securities and those that are commodities. Kraken chief...,https://cointelegraph.com/news/hyperbitcoinization-coming-says-bitcoin-og-as-wholecoiners-hit-1-million,
