timestamp,title,text,link,scam
2023-05-31,Winklevoss twins to apply for UAE virtual asset licence,"And that wasn't a Gemini thing, that wasn't a Coinbase thing, that wasn't Kraken thing, that wasn't a crypto thing. “It was one bad actor [Sam Bankman-Fried]...",https://www.thenationalnews.com/business/money/2023/06/01/winklevoss-twins-to-apply-for-uae-virtual-asset-licence/,
2023-05-31,FTX-Backer Tribe Capital Looks to Raise $100M Crypto Fund ...,"Prescient Bitcoin Whale Moves $244M in BTC to Crypto Exchange. ... Venture capital company Tribe Capital, which has previously backed cryptocurrency firms Kraken...",https://www.coindesk.com/business/2023/05/31/venture-capital-firm-tribe-capital-targets-100m-for-latest-crypto-fund/,
2023-05-18,Congressional crypto hearing illustrates political stalemate on ...,"... crypto exchanges, none of which are registered as national securities exchanges. ... Kraken chief legal officer Marco Santori described how the current gaps in...",https://cointelegraph.com/news/congressional-crypto-hearing-political-stalemate-on-digital-assets,
2023-06-06,"Bitcoin User Surge Defies LUNA, FTX Crises","The former, a crypto exchange founded by Sam Bankman-Fried and Gary Wang in ... Shiba Inu Price Triggers: Reviewing SHIB with Kraken. LUNA, on the other hand...",https://u.today/bitcoin-user-surge-defies-luna-ftx-crises,
2023-05-30,72% of Ethereum Liquidity Limited to These 5 Crypto Exchanges,"... ethereum liquidity is limited to five crypto exchanges, according to a new report. The exchanges in question are Binance, Bitfinex, OKX, Coinbase, and Kraken.",https://beincrypto.com/5-crypto-exchanges-ethereum-liquidity/,
2023-05-16,Sparklo Attracting Investors As Bitcoin And Ethereum Hang In ...,"On the 6th of May, 2023, it was stated that the Ethereum foundation transferred Ethereum (ETH) worth $30 million to the Kraken cryptocurrency exchange. The sale...",https://beincrypto.com/sparklo-attracting-investors-as-bitcoin-and-ethereum-hang-in-uncertainty/,
2023-06-05,"Binance was wrong to boot Monero, Zcash and other privacy ...",Crypto exchanges should refrain from banning privacy coins when ... Regulated exchanges manage to comply with U.S. Anti-Money Laundering laws — including Kraken...,https://cointelegraph.com/news/binance-wrong-monero-zcash-privacy-coins,
2023-05-12,US taxman seeks $44 billion from what's left of FTX/Alameda,"Kraken isn't publicly traded, but Coinbase (NASDAQ: COIN), the leading U.S.-based exchange, is. ... crypto tax conundrum: Pay taxes in crypto, pay more taxes...",https://coingeek.com/us-taxman-seeks-44-billion-from-what-left-of-ftx-alameda/,+
2023-05-30,"Ethereum will drive global cryptocurrency adoption, not Bitcoin ...",Kraken · eToro · Binance.US · Marathon Digital · CleanSpark...,https://cryptoslate.com/ethereum-will-drive-global-cryptocurrency-adoption-not-bitcoin-roger-ver/,
2023-05-15,BRC-20 Explained: How Bitcoin Tokens Work and the ...,"Fees were spiking, and leading crypto exchange Binance had to pause withdrawals – twice. ... This is good for Bitcoin,” ex-Kraken executive and long time...",https://www.coindesk.com/learn/brc-20-explained-how-tokens-on-bitcoin-work-and-why-they-are-controversial/,
2023-05-22,Malaysia Orders Huobi to Shut Down Local Business,"The shutdowns of Huobi and LocalBitcoins will likely see take business to one of several other exchanges. Malaysians favor Bitpanda, Paybis, Kraken, eToro...",https://beincrypto.com/malaysian-regulator-huobi-closure/,
2023-05-18,"Report: Bitcoin miner Bit Digital expands in Iceland, stock jumps","It fined Kraken over $40M for these staking products. The SEC is also battling other companies in the crypto industry. For example, it is fighting Ripple Labs,...",https://invezz.com/news/2023/05/18/report-bitcoin-miner-bit-digital-expands-in-iceland-stock-jumps/,
2023-05-09,"Bitcoin transaction fees surge, El Salvador users suffer consequences",... Bitcoin transactions faster and cheaper. A number of exchanges including Kraken and Bitfinex are now using the solution. A spokesperson for Binance said in...,https://finance.yahoo.com/news/bitcoin-transaction-fees-surge-el-082734925.html,+
2023-05-25,"Crypto Winter Is Still Tanking Web3 Startup Valuations, Data ...",And it's especially poignant in secondary markets as the valuations of several late-stage companies like Chainalysis and Kraken ... crypto exchange Kraken's has...,https://www.businessinsider.com/crypto-winter-web3-startup-valuations-forge-global-secondary-markets-2023-5,+
2023-06-01,How to Buy Crypto with Wise?,"... cryptocurrency exchanges. You can use the Wise card to make deposits to exchanges like Binance, Coinbase and Kraken. In this article, we will show you the...",https://coincodex.com/article/27958/how-to-buy-crypto-with-wise/,
2023-05-22,Biden Slams Wealthy Crypto Traders as U.S. Budget Talks Resume,"Solana Drops 5% as FTX-Linked Address Moves SOL to Kraken, Binance. After flying high the last few weeks, it now looks like Solana is headed back down to...",https://decrypt.co/140869/us-debt-ceiling-budget-battle-crypto-traders,
2023-05-10,Galaxy Digital to Shift Base from US Amid Regulatory Crackdown,"The Bitcoin bull and billionaire investors said that following the collapse of the crypto exchange ... Coinbase, Kraken, and many others. Recommended Articles.",https://coingape.com/crypto-giant-galaxy-digital-moving-operations-off-shore-citing-us-regulatory-headache/,
2023-05-18,How to Use Etherscan and Other Blockchain Explorers,"That said, you can see some interesting information about exchanges, such as how much ETH crypto exchange Kraken holds in one of its wallets. Other...",https://www.coindesk.com/learn/how-to-use-etherscan-and-other-blockchain-explorers/,
2023-06-04,Coinbase derivatives exchange to introduce Bitcoin and Ether ...,... Kraken. This sort of private trading environment is not offered on any significant trading platform. But Tradecurve will also provide many more features...,https://www.analyticsinsight.net/coinbase-derivatives-exchange-to-introduce-bitcoin-and-ether-future-tradecurve-to-offer-crypto-and-derivatives-on-one-single-account/,
2023-06-10,Fox Journalist Spotlights Ripple Billboard Around SEC ...,"FTX and Alameda Move Additional $46M in SOL, ETH, Others to Kraken, Binance and Coinbase ... Crypto Exchange News · Crypto Analysis · Bitcoin News · Ethereum News...",https://thecryptobasic.com/2023/06/10/fox-journalist-spotlights-ripple-billboard-around-sec-headquarters/,
2023-05-18,Who are the biggest Bitcoin whales in the world,"... Kraken, and more, over the course of many years. The multi-millionaire Bitcoin proponent has been interested in the king coin since early 2011, and has even...",https://www.cnbctv18.com/cryptocurrency/who-are-the-biggest-bitcoin-whales-in-the-worldcheck-here-16703101.htm,
2023-06-06,Crypto Valley Conference 2023,"YouHodler was joined at the event by representatives from NASDAQ, CME, Circle, Kraken ... Store, exchange, and spend fiat, stablecoins and crypto. Rewards...",https://www.youhodler.com/blog/crypto-valley-conference-2023,
2023-05-09,"Central Bank of Ireland Warns Against ""Ponzi Scheme"" Bitcoin",... Kraken with its headquarters in Dublin. Binance and Coinbase expanded in the ... crypto assets like TerraUSD stablecoin and crypto exchange FTX. Makhlouf...,https://coingape.com/central-bank-of-ireland-warns-against-ponzi-scheme-bitcoin/,
2023-06-07,What the Collapses of Signature Bank and Silvergate Capital ...,"... crypto firms were being ejected wholesale from US banking. The powerful US crypto-advocacy organisation, with its members including Circle, Ripple and Kraken...",https://internationalbanker.com/technology/what-the-collapses-of-signature-bank-and-silvergate-capital-mean-for-crypto/,
2023-05-25,Lama Technology: A Suite of Blockchain Financial Products,"... exchange feature available on the platform for instant conversion of crypto and traditional currencies. ... exchanges such as Binance, Kraken, and more. With...",https://blockonomi.com/lama/,+
2023-05-13,"Big Eyes Coin Sets Paws In Crypto Casino Market, Challenges Ethereum And Chainlink","One notable transaction involved the transfer of 15,000 ETH from an Ethereum Foundation wallet to a deposit address on the Kraken exchange. Ethereum.",https://www.outlookindia.com/business-spotlight/big-eyes-coin-sets-paws-in-crypto-casino-market-challenges-ethereum-and-chainlink-news-286032,
2023-05-31,"Bitcoin Price Prediction as BTC Bounces Off $27,000 Support ...",View all exchanges. BitcoinBTC. -0.1%. Buy for. kucoin. 27453.70/Sell for. kraken. 27922.60. EthereumETH. -0.76%. Buy for. kucoin. 1573.46/Sell for. kraken.,https://cryptonews.com/news/bitcoin-price-prediction-as-btc-bounces-off-27000-support-level-where-next-btc-target.htm,
2023-05-29,"Catch the Hottest Crypto Gainers of the Day, Including a Viral ...",... Crypto Platform – What's the Buzz? Similar News. Kraken Appoints Fintech Entrepreneur Bivu Das as New UK Managing Director. Blockchain News · Kraken Appoints...,https://cryptonews.com/news/catch-the-hottest-crypto-gainers-of-the-day-including-a-viral-meme-coin-on-the-verge-of-tier-one-exchange-listing-secure-early-buying-opportunities.htm,
2023-06-12,IPO Plans of Circle Expected to Propel XLM Price to New All ...,"Crypto exchange Coinbase went public in April 2021, after the SEC approved its ... Another company that has hinted at going public is the Crypto exchange Kraken.",https://www.crypto-news-flash.com/usdcs-stellar-rise-circles-unstoppable-ipo-plans-amid-sec-action-expected-to-propel-xlm-price-to-new-all-time-highs/,
2023-05-17,Coinbase launches Layerswap for zkSync Era,"In addition to Coinbase, Layerswap's list of crypto-exchanges also includes KuCoin, Kraken, Binance.US, Huobi, Bittrex, Bitfinex, and others. Hence, thanks to...",https://en.cryptonomist.ch/2023/05/17/coinbase-launches-layerswap-zksync-era/,
2023-06-01,How the Upcoming US Jobs Report Might Impact the Bitcoin ...,"kraken. 251.24. EOSEOS. +4.51%. Buy for. kucoin. 0.5749/Sell for. bitstamp. 0.57578 ... Crypto Exchange Bitfinex Diversifies, Adds Bitcoin to Balance Sheet.",https://cryptonews.com/news/how-upcoming-us-jobs-report-might-impact-bitcoin-btc-price.htm,
2023-06-12,Investor's Guide: How to Determine if a Crypto Token is a ...,Non Fungible Tokens: Are NFTs a good investment in 2021? Crypto Exchanges...,https://cryptoticker.io/en/crypto-token-is-a-security/,
2023-05-22,Pepe The Frog ($PEPE) surpasses Dogecoin,... crypto-exchanges. The latest on the list was Kraken last Tuesday. Here's the announcement on Twitter: Now available: $PEPE @pepecoineth ✔️ Deposits...,https://en.cryptonomist.ch/2023/05/22/pepe-frog-pepe-surpasses-dogecoin/,
2023-05-14,Bermuda beckons: US crypto firms flee regulatory headwinds,"In recent months, the Securities and Exchange Commission has targeted cryptocurrency companies such as Coinbase, Kraken, Bittrex, and Genesis with enforcement...",https://www.cryptopolitan.com/bermuda-beckons-for-us-crypto-firms/,
2023-05-22,"Best Crypto to Buy Now 22 May – Render, Copium, Tron ...","According to ecoterra's timeline, crypto exchange listings are planned for the third quarter of 2023. ... kraken. 0.02583/Sell for. bitfinex. 0.02585. See more...",https://cryptonews.com/news/best-crypto-buy-now-22-may-render-copium-tron-aidogecom-apecoin-sponge-ecoterra.htm,
2023-05-20,Digital Asset Exchange HashKey Raising Funds at $1 B ...,"Coinbase, Kraken, Kucoin, Bybit, and Bitget are some of the leading exchanges in the industry. A few months ago, FTX, the third largest cryptocurrency exchange,...",https://www.thecoinrepublic.com/2023/05/20/digital-asset-exchange-hashkey-raising-funds-at-1-b-valuation/,
2023-06-03,A Beginner's Guide: How to Invest $1000 in Cryptos in 2023,"Look for exchanges that are reputable, secure, and offer a wide range of cryptocurrencies. Popular options include Coinbase, Binance, and Kraken. Take the...",https://cryptoticker.io/en/beginners-guide-how-to-invest-in-cryptos/,
2023-05-18,Coinbase to Integrate the BTC Lightning Network,"... Exchange Commission (SEC), which has become a major bully on the crypto playground. The agency has made a living out of attacking crypto firms such as Kraken...",https://www.livebitcoinnews.com/coinbase-to-integrate-the-btc-lightning-network/,+
2023-06-10,Crypto News: Baby Doge And Shiba Inu List On Binance As Big Eyes Coin Locks-In CEX Listing With Poloniex,"The world's largest crypto exchange recognizes Shiba Inu's exceptional quality and ... With Binance, Kraken, Bitfinex, and Bitstamp still in the running, the...",https://www.outlookindia.com/business-spotlight/crypto-news-baby-doge-and-shiba-inu-list-on-binance-as-big-eyes-coin-locks-in-cex-listing-with-poloniex-news-293678,
2023-05-11,Su Zhu of Three Arrows Capital Gets Restraining Order ...,View all exchanges. BitcoinBTC. +3.21%. Buy for. kraken. 29583.10/Sell for. gdax. 30760.10. EthereumETH. +2.62%. Buy for. kraken. 1606.76/Sell for. gdax.,https://cryptonews.com/news/su-zhu-of-three-arrows-capital-gets-restraining-order-against-billionaire-arthur-hayes-amid-dispute.htm,
2023-05-23,Best Crypto Trading Bots For Automated Trading (TOP Free & Paid),"RevenueBOT currently supports trading on several major cryptocurrency exchanges, including Binance, Bitfinex, BitMEX, Bitstamp, Kraken, and Poloniex. The...",https://www.outlookindia.com/outlook-spotlight/best-crypto-trading-bots-for-automated-trading-top-free-paid--news-288748,
2023-05-27,Coinbase Review 2023 - Is Coinbase a Good Exchange?,Kraken Review 2022 – Is Kraken a Good Exchange? To the article. Coinbase pro takes trading cryptocurrencies to the next level. It features a trading...,https://cryptoticker.io/en/coinbase-review-is-coinbase-a-good-exchange/,
2023-05-23,"Best Ethereum Casino Sites 2023 New, Updated & Ranked","Purchase ETH: Buy ETH from a cryptocurrency exchange, such as Coinbase, Binance, or Kraken, using your preferred payment method. Deposit Ethereum to your...",https://bitcoinist.com/best-ethereum-casino-sites/,
2023-06-02,11 Best Crypto Staking Platforms: A Curated List 2023,"A crypto futures exchange is a specialised platform for trading cryptocurrency futures contracts. ... Launched just two years after Bitcoin (BTC), Kraken has...",https://coinculture.com/au/exchanges/best-crypto-staking-platforms/,+
2023-05-31,How To Buy Wall Street Memes Presale [Step-By-Step-Guide],Join Our Telegram channel to stay up to date on breaking news coverage State-backed ... Continue Reading. New Cryptos. Bitcoin Minetrix · Launchpad XYZ · Meme...,https://insidebitcoins.com/news/how-to-buy-wall-street-meme-presale-step-by-step-guide,
2023-06-10,Australia’s Commonwealth Bank To Partially Restrict Payments To Crypto Exchanges,... Exchange Comparisons · CoinSpot vs Swyftx · CoinSpot vs Digital Surge · CoinSpot vs Coinbase · Coinspot vs Binance · CoinSpot vs Kraken · CoinSpot vs...,https://coinculture.com/au/policy-regulation/australias-commonwealth-bank-to-partially-restrict-payments-to-crypto-exchanges/,
2023-05-24,AiDoge Presale Selling Fast - Set To Explode At Launch,... Coinbase · eToro vs Coinbase. Best Platforms. eToro · OKX · Binance · Bybit · Coinbase · Kraken ... Bitcoin · Gaming · Best Coins · Buy NFTs.,https://insidebitcoins.com/news/aidoge-presale-selling-fast-set-to-explode-at-launch,
2023-05-22,Crypto Exchange Listing and Delisting Announcements: May ...,Cryptonews Altcoin News Crypto Exchange Listing and Delisting Announcements ... Kraken Pro Listings: LimeWire (LMWR) · KuCoin. Listings: Bob (BOB) · Milady Meme...,https://cryptonews.com/news/crypto-exchange-listing-and-delisting-announcements-may-2023.htm,
2023-05-10,Bitboy Token Prediction: Ben Price To Retrace After 1000 ...,"The announcement of $SPONGE hitting the crypto exchange, MEXC Global, and its ... kraken. 0.02583/Sell for. bitfinex. 0.02585 · See more rates. Recommended. US...",https://cryptonews.com/news/bitboy-token-prediction-ben-price-retrace-after-1000-rise-whilst-aidoge-sponge-pump.htm,
2023-05-25,"A husband hid $500,000 in Bitcoin during a divorce, traders ...","... Bitcoin (BTC) privately. While most traditional platforms, like Binance, Kraken, OKX, Coinbase, and others, require mandatory Know-Your-Customer (KYC)...",https://www.crypto-news-flash.com/a-husband-hid-500000-in-bitcoin-during-a-divorce-traders-can-trade-privately-on-tradecurve-io/,
2023-05-16,"Cryptocurrency Market Update: A Mixed Bag of Gains and Losses on May 16, 2023","The top three cryptocurrency exchanges, Binance, Coinbase Exchange, and Kraken, witnessed substantial increases in their 24-hour trading volumes. The global...",https://www.financialwatchngr.com/2023/05/16/cryptocurrency-market-update-a-mixed-bag-of-gains-and-losses-on-may-16-2023/,
2023-06-01,How to Buy Crypto with Capital One Credit Card in 2023: Step ...,"... Kraken and Coinbase charge a total of 2%, including both the fee and spread. Capital One's Cryptocurrency Policy, Capital One recently updated their...",https://captainaltcoin.com/buy-crypto-with-capital-one-credit-card/,
2023-05-31,US Senator Warren Calls Out Crypto's Role in Fentanyl ...,EthereumETH. +0.87%. Buy for. coinbase. 1553.35/Sell for. bitfinex. 1559.10. BitcoinCashBCH. +2.44%. Buy for. kucoin. 215.46/Sell for. kraken. 217.33. EOSEOS. +...,https://cryptonews.com/news/us-senator-warren-calls-out-cryptos-role-fentanyl-transactions.htm,
2023-06-12,"If SHIB returns to all-time highs, how much would a Shiba Inu ...","Previously only available on decentralized exchanges such as Uniswap, Shiba Inu was added to cryptocurrency platforms such as Coinbase, Kraken And Robin Hood.",https://cryptosaurus.tech/if-shib-returns-to-all-time-highs-how-much-would-a-shiba-inu-be-worth-today-100-5/,
2023-07-13,Ripple effect: Coinbase and Kraken among exchanges to relist XRP after court ruling vs. SEC,"Coinbase, Kraken, and Bitstamp announced that they would reinstate the cryptocurrency on their platforms. On Friday, Crypto.com joined the XRP bandwagon.",https://fortune.com/crypto/2023/07/13/coinbase-kraken-bitstamp-gemini-xrp-relisting-ripple-decision/,
2023-07-14,Crypto Exchanges Allow XRP Trading After Ripple Ruling,"Coinbase, Kraken, and other major crypto exchanges have relisted Ripple's XRP in response to a court ruling that the digital asset itself is not an offering of...",https://www.investopedia.com/crypto-exchanges-allow-xrp-trading-after-ripple-ruling-7561172,
2023-07-13,US crypto exchanges give XRP listings a 2nd chance after ...,"After two years, Coinbase said it will reenable XRP trading, Kraken and iTrustCapital announced they had already relisted the token, and exchanges including...",https://cointelegraph.com/news/us-crypto-exchanges-second-chance-xrp-listings-after-court-ruling,
2023-07-06,F.B.I. Searched the Home of Kraken’s Jesse Powell,"Federal agents were investigating Jesse Powell, the founder of the crypto exchange Kraken, over claims that he hacked and cyber-stalked a nonprofit arts group.",https://www.nytimes.com/2023/07/06/technology/jesse-powell-kraken-crypto-fbi.html,+
2023-07-06,"FBI Searched Kraken Founder Jesse Powell’s House Over Cyberstalking Claims, Report Says",Jesse Powell—the founder and former CEO of crypto exchange Kraken—had his home searched by the FBI earlier this year as part of a hacking and cyberstalking...,https://www.forbes.com/sites/antoniopequenoiv/2023/07/06/fbi-searched-kraken-founder-jesse-powells-house-over-stalking-claims-report-says/,+
2023-07-07,FBI searched Kraken co-founder's home in March: Report,"... cryptocurrency exchange behind Coinbase, according to CoinMarketCap. Kraken was hit with enforcement action by the U.S. Securities Exchange Commission in...",https://cointelegraph.com/news/fbi-search-kraken-founder-jesse-powell-home,
2023-07-03,Rich crypto traders to face IRS scrutiny after judge rules against Kraken,"Dave Ripley, CEO of Kraken, during the Bitcoin 2023 conference. Eva Marie Uzcategui—Bloomberg/Getty Images.",https://fortune.com/crypto/2023/07/03/kraken-irs-wealthy-taxpayers-20000-judge-summons-transaction-records/,+
2023-07-11,Cryptoverse: Hungry exchanges fight for slice of American pie,"... crypto chaos. Rivals scent blood. Kraken, Bitstamp and LMAX Digital - an institutional crypto exchange - have seen their market shares increase since the...",https://www.reuters.com/business/finance/cryptoverse-hungry-exchanges-fight-slice-american-pie-2023-07-11/,
2023-07-14,XRP Trading Volume Surges 1351% as Major Crypto ...,"The trading frenzy happened as Coinbase, Kraken and other exchanges re-listed or announced plans to reopen trading with the token on their platforms after a...",https://www.coindesk.com/markets/2023/07/14/xrp-trading-volume-surges-1351-as-major-crypto-exchanges-embrace-the-token/,
2023-06-15,BlackRock's iShares Files Paperwork for Spot Bitcoin ETF,"""The proposed ETF is benchmarked against the CME CF Bitcoin Reference Rate,"" said Sui Chung, CEO of CF Benchmarks, a subsidiary of crypto exchange Kraken,...",https://www.coindesk.com/business/2023/06/15/blackrocks-ishares-files-paperwork-for-spot-bitcoin-etf/,
2023-07-11,Coinbase and Binance Market Share Lost to Kraken and ...,"... Exchange Commission (SEC) sued Coinbase. Kraken's US crypto trading volumes has grown to 29%, while Bitstamp, another international exchange with a US...",https://beincrypto.com/coinbase-binance-market-share-lost-kraken-bitstamp/,
2023-07-04,Bitcoin futures premium hits 18-month high — Time to flip ...,The exchange Kraken was required by the U.S. District Court for the Northern District of California to provide details of users who engaged in transactions...,https://cointelegraph.com/news/bitcoin-futures-premium-18-month-high-flip-bullish,
2023-06-18,"The Post-FTX Effect: Bybit, Kraken, and Bitget With Growing Trading Volumes (Nansen)","According to data provided by the blockchain analytics firm – Nansen – exchanges like Bybit, Kraken, and Bitget have overcome the FTX shock and boosted their...",https://cryptopotato.com/the-post-ftx-effect-bybit-kraken-and-bitget-with-growing-trading-volumes-nansen/,
2023-06-20,Binance confirms Bitcoin Lightning Network integration in the ...,Crypto exchanges Kraken and OKX have established Bitcoin Lightning Network connections with Binance nodes. ... Cryptocurrency exchange Binance confirmed it was...,https://cryptoslate.com/binance-confirms-bitcoin-lightning-network-integration-in-the-works/,+
2023-06-21,Bitcoin ETF Printer Goes ‘BRRR’ as Valkyrie Refiles With SEC,"... trading data aggregated across a handful of major Bitcoin exchanges: Coinbase, Bitstamp, Gemini, itBit, Kraken, and LMAX Digital. The filing notes that...",https://finance.yahoo.com/news/bitcoin-etf-printer-goes-brrr-211637914.html,
2023-07-14,XRP Gets Binance.US Listing as Exchange Joins Rivals ...,"Binance.US joins rival crypto exchanges including Coinbase, Kraken, Bitstamp in listing XRP for trading. By Sage D. Young. Updated Jul 14, 2023 at 12:59 p.m....",https://www.coindesk.com/business/2023/07/14/xrp-gets-binanceus-listing-as-exchange-joins-rivals-embrace/,
2023-06-16,DeFi Credit Protocol Concordia Raises $4M in Round Led by ...,"Prescient Bitcoin Whale Moves $244M in BTC to Crypto Exchange. Has BTC ... Kraken Ventures, with Cypher Capital and Saison Capital among the other participants.",https://www.coindesk.com/business/2023/06/16/defi-credit-protocol-concordia-raises-4m-in-round-led-by-tribe-kraken/,
2023-06-21,"Whales Withdraw Over $150,000,000 in Ethereum (ETH) From Crypto Exchanges Binance and Kraken: On-Chain Data",Three crypto whales withdrew more than $150 million worth of Ethereum (ETH) from the crypto exchanges Binance and Kraken in the past week.,https://dailyhodl.com/2023/06/21/whales-withdraw-over-150000000-in-ethereum-eth-from-crypto-exchanges-binance-and-kraken-on-chain-data/,
2023-07-13,Celsius Ex-CEO Alex Mashinsky Is Arrested,"... Kraken, the second-largest U.S. exchange. And in June, Changpeng Zhao, the chief executive of Binance, the world's largest crypto exchange, was sued by the...",https://www.nytimes.com/2023/07/13/business/celsius-cryptocurrency-founder-arrested.html,+
2023-06-19,"Analysis | SVB, Silvergate and Why Crypto Still Needs Banks",This mostly happens via crypto exchanges such as Coinbase and Kraken as they accept money through bank transfers or credit card payments. It's possible to trade...,https://www.washingtonpost.com/business/2023/06/19/svb-silvergate-and-why-crypto-still-needs-banks-quicktake/bfab3f6a-0eab-11ee-8d22-5f65b2e2f6ad_story.html,
2023-07-16,Kraken Finally Allows Trading for Ripple (XRP) for US Residents,"Kraken, one of the leading cryptocurrency exchanges, is thrilled to announce that residents of the United States can now deposit and trade Ripple (XRP).",https://medium.com/coinmonks/kraken-finally-allows-trading-for-ripple-xrp-for-us-residents-85da4de29c19,
2023-07-05,Less than 10% of all bitcoin trading volume happens in the US ...,"... crypto exchanges, leaving tons of transactional revenue off the table for platforms like Coinbase and Kraken. And a newly released report from CCData...",https://blockworks.co/news/bitcoin-trading-volume-us,
2023-07-09,Kraken Enlists YouTuber to Help Bust Crypto Scam Operation,Call Center Scammers Target Crypto Exchange Users. It's one of the oldest ... Kraken Helps Bait Crypto Scam Operators. Prior to contacting the scam call...,https://beincrypto.com/youtuber-kraken-crypto-scam-operation/,+
2023-06-21,'One-Two Punch' Against Crypto Industry: SEC Files Back-to ...,"(“CGI”).[13]The SEC alleges that Coinbase operated as an unregistered securities exchange ... Interestingly, when SEC laid the same charges against Kraken in...",https://www.fasken.com/en/knowledge/2023/06/one-two-punch-against-crypto-industry-sec-files-back-to-back-complaints-against-binance-and-coinbase,
