timestamp,title,text,link,scam
2023-04-05,Eventus hires ex-Kraken Jonathan Dixon as Director of ...,"Jonathan Dixon joins Eventus after serving as Kraken's Head of Trade Surveillance where he managed a surveillance team of 13, covering both the Crypto Spot...",https://financefeeds.com/eventus-hires-ex-kraken-jonathan-dixon-as-director-of-regulatory-affairs-for-emea/,
2023-04-07,Thanks Sam! How FTX Led to World’s Worst Crypto Policy,"You can argue that the crackdown against Kraken, Coinbase (COIN), Paxos, Binance and others was driven significantly by a desire to punish Sam Bankman-Fried...",https://www.coindesk.com/consensus-magazine/2023/04/07/thanks-sam-how-ftx-led-to-worlds-worst-crypto-policy/,
2023-04-25,Amboss Technologies Raises $4M Led by Stillmark to Optimize the Bitcoin Lightning Network as the Financial System of the Future,"space including nodes hosted by industry leaders like Kraken Exchange and Jack Dorsey's Lightning-focused Block subsidiary ""TBD. ... bitcoin, the Bitcoin...",https://finance.yahoo.com/news/amboss-technologies-raises-4m-led-220000034.html,
2023-04-03,Bakkt finalizes $155M acquisition of Apex Crypto,Riot Platforms · Kraken · eToro · Binance.US · PayPal · Microsoft · Coinbase...,https://cryptoslate.com/bakkt-finalizes-155m-acquisition-of-apex-crypto/,
2023-05-02,XRP Lawsuit: Legal Expert Suggests Ripple May Consider Settlement Even If It Scores Major Win Against SEC,One important consideration would be whether leading U.S.-based digital assets exchanges like Coinbase and Kraken ... Brenda is a crypto and Blockchain enthusiast...,https://zycrypto.com/xrp-lawsuit-legal-expert-suggests-ripple-may-consider-settlement-even-if-it-scores-major-win-against-sec/,+
2023-04-05,Hot Wallet vs. Cold Wallet - Cryptocurrency,... crypto exchange from the wallet. Exchanging crypto from a cold wallet starts ... Kraken. “What Is a Crypto Hardware Wallet?” Gemini's Cryptopedia. “What Is a...,https://www.investopedia.com/hot-wallet-vs-cold-wallet-7098461,
2023-04-19,"Boasting Hearty Gains, Rocket Pool Cracks the Top 50","In Feb., the SEC went after the staking-as-a-service program that led crypto exchange Kraken to shut down its US staking service. While Kraken settled with...",https://www.securities.io/boasting-hearty-gains-rocket-pool-cracks-the-top-50/,
2023-04-04,21Shares launches ETP for Bitcoin L2 network Stacks,Kraken · Matrixport · BlackRock ... Leading crypto exchange-traded product (ETP) issuer 21Shares has launched a...,https://cryptoslate.com/21shares-launches-etp-for-bitcoin-l2-network-stacks/,
2023-04-03,Bitcoin Price Prediction as BTC Rallies 19% in a Month – Is ...,View all exchanges. BitcoinBTC. +1.74%. Buy for. kraken. 28730.00/Sell for. bitfinex. 29225.00. EthereumETH. +0.6%. Buy for. cryptocom. 1567.23/Sell for.,https://cryptonews.com/news/bitcoin-price-prediction-as-btc-rallies-19-month-bear-market-over.htm,
2023-04-17,"Top Crypto Gainers Today 17 April – Casper, Injective ...","On April 16, a tweet announced that the Injective mainnet had integrated with Kraken Exchange, a prominent cryptocurrency exchange platform. In addition...",https://cryptonews.com/news/top-crypto-gainers-today-17-april-casper-injective-protocol-rocket-pool.htm,
2023-04-27,Today in Crypto: Hackers Using Victims' AT&T Email ...,"... Kraken Fights IRS, Circle Launches Mainnet Protocol for USDC Transfers Between Ethereum ... crypto exchange accounts and steal their crypto, TechCrunch reported.",https://cryptonews.com/news/today-in-crypto-hackers-using-victims-att-email-addresses-to-steal-crypto-revolut-partners-with-koinly-kraken-fights-irs-circle-launches-mainnet-protocol-for-usdc-transfers-between-ethereum-avalanch.htm,
2023-04-11,Billionaire Winklevoss Twins Invest $100 Million in Gemini ...,View all exchanges. BitcoinBTC. +1.74%. Buy for. kraken. 28730.00/Sell for. gdax. 29693.70. EthereumETH. +0.6%. Buy for. kucoin. 1567.27/Sell for. bitfinex.,https://cryptonews.com/news/billionaire-winklevoss-twins-invest-100-million-gemini-crypto-platform-heres-latest.htm,
2023-04-08,Bitcoin Price and Ethereum Prediction: BTC Remains Below ...,coinbase. 61.645/Sell for. hitbtc. 63.4963. RippleXRP. +2.37%. Buy for. kraken. 0.50844/Sell for. cryptocom. 0.51493. DashDASH. +1.12%. Buy for. hitbtc. 24.9097...,https://cryptonews.com/news/bitcoin-price-ethereum-prediction-btc-remains-below-28250-amid-strong-us-nonfarm-payroll-report.htm,
2023-04-16,Baby Doge Coin Rallies 20% In 24 Hours – Here’s Why,"... crypto exchanges are Binance, Coinbase, KuCoin, Kraken and Bitfinex. Of these lots, Binance, being the biggest crypto trading platform in the world, has...",https://www.newsbtc.com/altcoin/baby-doge-coin-rallies-20-in-24-hours-heres-why/,
2023-04-26,Why are Crypto Prices Are Pumping Today? 5 Best Crypto To ...,"Yuya Hasegawa, a crypto market analyst at Japanese crypto exchange Bitbank, noted ... exchanges such as Binance, Coinbase, Kraken, or KuCoin. Although market...",https://cryptonews.com/news/why-are-crypto-prices-are-pumping-today-5-best-crypto-buy-now-26-april.htm,
2023-05-04,Today in Crypto: Nigeria's Government Approves a National ...,Crypto exchange CryptoOrange partnered with payments platform Paysafe to offer new ... kraken. 1628.33. BitcoinCashBCH. -0.58%. Buy for. cryptocom. 229.63/Sell...,https://cryptonews.com/news/today-in-crypto-nigerias-government-approves-a-national-blockchain-policy-cex-trade-volumes-fall-for-1st-time-in-3-months-inx-works-with-bitgo-to-launch-a-pilot-wallet-management-solution-for-regulated-security-tokens.htm,
2023-04-27,Bahamas Securities Commission Unveils Draft Digital Assets ...,"... crypto exchange FTX. The new bill, titled the Digital Assets and Registered ... kraken. 29540.10. EthereumETH. +2.34%. Buy for. cryptocom. 1594.16/Sell for.",https://cryptonews.com/news/bahamas-securities-commission-unveils-draft-digital-assets-act-response-ftx-scandal-heres-latest.htm,
2023-04-11,Tier 1 Crypto Exchange for Your Digital Assets,"Top tier crypto exchanges, such as Binance, Coinbase, KuCoin, Kraken, P2B and others, have become popular among traders due to their high trading volume,...",https://insiderpaper.com/tier-1-crypto-exchange-for-your-digital-assets/,
2023-04-03,Huobi and Gala Games file a joint lawsuit against pNetwork.,"Metamask vs Coinbase Wallet. Crypto Tools. Cryptocurrency Converter · Mining ... Trade, the provider of Kraken's crypto exchange services in Australia. This...",https://crypto-economy.com/huobi-and-gala-games-file-a-joint-lawsuit-against-pnetwork/,+
2023-04-15,everything you need to know about crypto,"The easiest way to buy crypto is to rely on centralized service providers such as Binance, Coinbase, Kraken or Bitget. These are exchanges, i.e., trading...",https://en.cryptonomist.ch/2023/04/15/everything-you-need-to-know-about-crypto/,
2023-04-28,Is It Too Late to Buy Ethereum? Crypto Whales are ...,View all exchanges. BitcoinBTC. -0.2%. Buy for. kucoin. 27393.20/Sell for. coinbase. 27902.00. EthereumETH. +0.02%. Buy for. bitfinex. 1569.40/Sell for. kraken.,https://cryptonews.com/news/it-too-late-buy-ethereum-crypto-whales-are-accumulating-these-new-crypto-projects-instead.htm,
2023-05-03,Today in Crypto: Authorities Seize Domains of 9 Crypto ...,View all exchanges. BitcoinBTC. -2.7%. Buy for. coinbase. 26698.80/Sell for. bitfinex. 26880.00. EthereumETH. -0.3%. Buy for. kraken. 1563.04/Sell for. bitfinex.,https://cryptonews.com/news/today-in-crypto-authorities-seize-domains-of-9-crypto-exchanges-us-30-mining-tax-proposal-enters-budget-uk-to-ban-cold-calls-selling-crypto-youtuber-served-on-twitter.htm,
2023-04-24,Tamadoge Price Pump Incoming – Listing on Bybit Thursday ...,"... crypto exchange Bybit on Thursday April 27th at 8am UTC. ByBit is currently the ... Coinbase, Kraken, Binance or Kucoin join the TAMA army as partner exchanges.",https://cryptonews.com/news/tamadoge-price-pump-incoming-listing-bybit-thursday-april-27th-more-top-cexs-lined-up.htm,
2023-04-04,"William Quigley, Co-Founder of Tether and WAX, on Founding ...",Bitcoin Bitfury Blockchain CBDC Circle Coinbase Cryptocurrency Ethereum Kraken NFT PayPal Securities and Exchange Commission Stablecoin Tether WAX...,https://cryptonews.com/videos/william-quigley-co-founder-of-tether-and-wax-on-founding-companies-crypto-investing-and-more.htm,
2023-05-08,8 Best Crypto Shitcoins to Invest in with 100x Potenial 2023,... Coinbase · Kraken. Popular Guides. Best Crypto to Buy Now · Best DeFi Coins · How to Buy Bitcoin · How to Buy Cryptocurrency · Low Market Cap Cryptos · Crypto...,https://insidebitcoins.com/news/8-best-crypto-shitcoins-to-invest-in-with-100x-potenial-2023,
2023-05-08,"New Report: Despite Crypto Ban, Chinese Citizens Trade on ...",coinbase. 0.48805/Sell for. gdax. 0.5144. DashDASH. +0.08%. Buy for. hitbtc. 24.7575/Sell for. bitfinex. 25.328. CardanoADA. -0.17%. Buy for. kraken. 0.24407/...,https://cryptonews.com/news/new-report-despite-crypto-ban-chinese-citizens-trade-binance-ftx-exchanges.htm,
2023-04-24,Tether (USDT): market cap near record high,"... exchanges such as Binance, Bitfinex, Coinbase, Kraken, Okx Bybit, and offshore venues. It is worth mentioning in this regard that Tether is based in the...",https://en.cryptonomist.ch/2023/04/24/tether-usdt-market-cap-near-record-high/,
2023-04-21,"Julian Hosp, CEO of Cake DeFi, on DeFi for Bitcoin and the ...",And I'm saying this as a CEO of a Crypto company. So we're not an exchange. So I went to Kraken. Kraken has been since 2014. The exchange I've always used. I...,https://cryptonews.com/exclusives/julian-hosp-ceo-of-cake-defi-defi-for-bitcoin-current-crypto-market-ep-223.htm,
2023-04-13,Revolutionary New Crypto Platform Combines Social Media ...,"Join Our Telegram channel to stay up to date on breaking news coverage ConsenSys, ... Continue Reading. New Cryptos. Bitcoin Minetrix · Launchpad XYZ · Meme...",https://insidebitcoins.com/news/revolutionary-new-crypto-platform-combines-social-media-with-blockchain-technology-billion-dollar-opportunity,
2023-06-08,"Analysis: US SEC crackdown on Coinbase, Binance puts ...","That raises questions about other exchanges that have also allowed U.S. investors to trade those tokens, such as Kraken, Gemini, Crypto.com and Okcoin, and...",https://www.reuters.com/business/finance/us-sec-coinbase-binance-crackdown-puts-crypto-exchanges-notice-2023-06-08/,
2023-06-06,One-Two Punch Finally Registers SEC View on Binance ...,"... exchanges – such as Kraken, Gemini and crypto.com – can do without SEC trouble. The agency's legal position gathers “the types of charges from several years...",https://www.coindesk.com/policy/2023/06/06/one-two-punch-finally-registers-sec-view-on-binance-coinbase-rest-of-crypto/,
2023-06-07,SEC's Crypto Campaign Unlikely To Stop At Binance And ...,"... exchange not only in the U.S. but around the world. So what are crypto companies going to do? Many are not yet ready to say. Forbes contacted Kraken, Gemini...",https://www.forbes.com/sites/stevenehrlich/2023/06/07/secs-crypto-campaign-unlikely-to-stop-at-binance-and-coinbase/,+
2023-06-01,"Crypto Exchange Kraken Gains in Canada as Binance, OKX ...","Crypto Exchange Kraken's Canada Customer Deposits Rose 25% After Binance Announced Departure ... Like Kraken, Nasdaq-listed exchange Coinbase (COIN) said it was...",https://www.coindesk.com/business/2023/06/01/crypto-exchange-krakens-canada-customer-deposits-rose-25-after-binance-announced-departure/,
2023-05-30,"Bybit Latest to Flee Canada, but Not All Exchanges Are Leaving","Bybit has become the latest crypto exchange to exit Canada citing “recent regulatory development. ... Coinbase, Kraken and Gemini. BitBuy was founded in 2016 and...",https://blockworks.co/news/bybit-flees-canada,
2023-05-31,Bybit Joins Binance and Others to Exit Canada,"Before Bybit, Binance, the largest crypto exchange in terms of trading volume ... However, a few well-known cryptocurrency exchanges, including Coinbase, Kraken...",https://www.financemagnates.com/cryptocurrency/bybit-joins-binance-and-others-to-exit-from-canada/,
2023-05-10,Kraken Chief Legal Officer: Crypto Regulatory System In The ...,"Marco is currently Kraken's chief legal officer, and we used to work together at the exchange. In fact, he and I appeared on a panel together about crypto...",https://www.forbes.com/newsletters/forbescryptoassetadvisor/2023/05/10/kraken-chief-legal-officer-crypto-regulatory-system-in-the-us-is-untenable/,
2023-06-08,Kraken NFT Marketplace Launches Out of Beta,"Cryptocurrency exchange Kraken has officially launched its NFT marketplace out of beta testing, supporting over 250 non-fungible tokens (NFTs) across the...",https://www.coindesk.com/web3/2023/06/08/kraken-nft-marketplace-launches-with-support-for-ethereum-solana-and-polygon-collections/,
2023-06-06,Kraken says systems operational after issue with crypto ...,"June 6 (Reuters) - Cryptocurrency exchange Kraken said on Tuesday that it had resolved an outage that affected several funding gateways including Bitcoin, Ether...",https://www.reuters.com/technology/kraken-says-investigating-an-issue-with-several-crypto-funding-gateways-2023-06-06/,
2023-05-22,Bitcoin Pizza Day — A celebration of decentralization,Kraken makes it easy to share the gift of financial freedom on Bitcoin Pizza Day. Invite your friends to Kraken and you'll each get $10 in BTC through our...,https://blog.kraken.com/crypto-education/bitcoin-pizza-day-a-celebration-of-decentralization,
2023-05-18,"Kraken, UK trade body derides lawmaker description of crypto ...",Self-regulatory organization CryptoUK and crypto exchange Kraken have slammed a recent report from a panel of British lawmakers that suggested crypto should be...,https://cointelegraph.com/news/kraken-uk-trade-body-slam-treasury-crypto-as-gambling,
2023-05-11,To catch a scammer: Kraken builds fake crypto account to 'bait ...,"United States crypto exchange Kraken has provided a novel method for ... In the accompanying video clip, Kitboga can be seen with around $450,000 worth of Bitcoin...",https://cointelegraph.com/news/to-catch-a-scammer-kraken-builds-fake-crypto-account-to-bait-fraudsters,+
2023-05-09,Buying Bitcoin and Ether on Binance.US? You'll Pay a Premium,"... bitcoin for the US-dollar equivalent of $27,650 (paid in stablecoins). Coinbase and Kraken also show the cheaper prices. That's a 1.5% markup on buying bitcoin...",https://blockworks.co/news/bitcoin-on-binance-premium,
2023-05-13,"Coinbase screws up, Florida bans CBDCs, and Ordinals face ...",... Bitcoin. To catch a scammer: Kraken builds fake crypto account to 'bait' fraudsters. Crypto exchange Kraken has provided a novel method for flagging...,https://cointelegraph.com/magazine/coinbase-screws-up-florida-bans-cbdcs-and-ordinals-face-controversy-hodlers-digest-may-7-13/,+
2023-06-06,Buterin moves ETH to Kraken shortly before Binance suit ...,"In a recent development, Vitalik Buterin, the co-founder of ethereum, transferred 400 ETH to the Kraken exchange. ... crypto funding gateways, including bitcoin...",https://crypto.news/buterin-moves-eth-to-kraken-shortly-before-binance-suit-announced/,
2023-05-15,US crypto clampdown pushes exchanges to go offshore,"Since the start of the year Kraken agreed to end its staking business in the US, in which customers agree to lock up their tokens in other crypto projects...",https://www.ft.com/content/10979399-ba25-45b9-b85d-776c1b75bfea,
2023-06-01,First Mover Americas: Bitcoin Begins June Dropping Back ...,Cryptocurrency exchange Kraken is reaping the benefits of staying in Canada after rivals such as Binance and OKX set withdrawal plans. Kraken told CoinDesk...,https://www.coindesk.com/markets/2023/06/01/first-mover-americas-bitcoin-begins-june-dropping-back-below-27k/,
2023-05-19,Australian exchanges dispel debanking fears amid Binance ...,"Jonathon Miller, Kraken Australia's managing director, told Cointelegraph there are “only a couple” of payment providers in the local market “that are crypto-...",https://cointelegraph.com/news/australian-exchanges-dispel-debanking-fears-amid-binance-saga-but-risks-loom,
2023-06-09,Circle's public listing plans undeterred by latest SEC actions,"Until that changes, the IPO path will likely be postponed for most companies.” Kraken job posting also hints at continued IPO plans. Crypto exchange Kraken also...",https://blockworks.co/news/circles-public-listing-plans-undeterred,+
2023-06-01,"SHIB Perpetual Futures Listed on Kraken, Ripple Lawsuit Speculated to Settle in June, SHIB Lead Shytoshi Kusama Supposed to Be in Japan: Crypto News Digest by U.Today","Since Kraken is one of the largest crypto exchanges with millions of users, Shiba Inu has all the chances to increase its exposure via a new listing.",https://u.today/shib-perpetual-futures-listed-on-kraken-ripple-lawsuit-speculated-to-settle-in-june-shib-lead,
2023-05-12,Binance to leave Canada—the one-time home of cofounder CZ—claiming market conditions are ‘no longer tenable’,"Not every crypto company has chosen the same strategy. Binance's competitor, the U.S. exchange Kraken, signed a pre-registration undertaking with the...",https://fortune.com/crypto/2023/05/12/binance-announces-exit-canada-home-founder-cz-zhao/,+
2023-05-16,What is Pepe (PEPE)? Meet the latest viral meme coin ...,Kraken Blog. News · Product · Crypto Education · Sign in · News · Product · Crypto ... The team also hopes to achieve more crypto exchange listings and increase...,https://blog.kraken.com/crypto-education/what-is-pepe-pepe-meet-the-latest-viral-meme-coin-phenomenon,
2023-06-07,Crypto heavy hitters largely back FASB fair-value fix,"... crypto assets,” Natalia Voronina, chief accounting officer at San Francisco-based crypto exchange Kraken, wrote in a May 25 letter, characterizing the...",https://www.cfodive.com/news/crypto-heavy-hitters-largely-back-fasb-fair-value-fix/652391/,
2023-06-05,Kraken Appoints Former StockX Executive Vishnu Patankar as ...,"For more information about Kraken, please visit www.kraken ... RSS feed for Kraken Digital Asset Exchange. October 05, 2023. Kraken to Acquire Dutch Crypto Broker...",https://www.businesswire.com/news/home/20230605005144/en/Kraken-Appoints-Former-StockX-Executive-Vishnu-Patankar-as-CTO,
2023-06-07,"Will MiCA Jumpstart Crypto in EU? It's ‘Too Early To Tell’, Says Circle","Beata Sivak, crypto exchange Kraken's head of government relations and policy for Europe, said that MiCA “gives us the ability to really invest in the region.",https://finance.yahoo.com/news/mica-jumpstart-crypto-eu-too-184355766.html,
2023-05-25,From Silicon Valley to London: Winklevoss Twins Plot Crypto Pivot,"Almost four months ago, Kraken, another cryptocurrency exchange, suspended some of its services in the US after paying a $30 million settlement in relation...",https://www.financemagnates.com/cryptocurrency/from-silicon-valley-to-the-city-of-london-winklevoss-twins-plot-crypto-pivot/,+
2023-05-26,Bitcoin Miner Riot Dumps Auditor for 'Big Four' Accounting Firm,Kraken did not return a request for comment. A Bloomberg survey of 24 crypto companies last week found 46% of them had their full financial audits completed by...,https://blockworks.co/news/riot-dumps-auditor,
2023-05-11,'Memepool' full: Here's how exchanges adjust Bitcoin ...,... cryptocurrency exchanges have moved to adjust the cost of withdrawing BTC from their platforms. The United States-based exchange Kraken has increased Bitcoin...,https://cointelegraph.com/news/how-exchanges-adjust-bitcoin-withdrawal-fees,
2023-06-02,Binance CEO Changpeng Zhao on Layoffs Rumors: 'Another ...,"... exchange was hiring for 2,000 roles, while other crypto companies like Coinbase and Kraken were involved in thousands of layoffs. What do you think about...",https://news.bitcoin.com/binance-ceo-changpeng-zhao-on-layoffs-rumors-another-day-another-fud/,
2023-05-11,Congress Needs To Clarify Who Regulates Crypto In The U.S. ...,"Peirce's comments come amid the SEC crackdown on crypto companies. In the past few months, the SEC has taken action against Coinbase (COIN), Kraken, and Bittrex...",https://www.investopedia.com/sec-commissioner-hester-peirce-on-cryptocurrency-regulation-7496292,
2023-06-09,"Bitcoin, Ether rise amid ‘swoon-soar’ trading after SEC lawsuits against Binance, Coinbase","In another development, crypto exchange Kraken has launched its NFT marketplace out of beta with over 250 collections. Luca Netz, the chief executive...",https://forkast.news/bitcoin-ether-rise-amid-swoon-soar-trading-after-sec-lawsuits-against-binance-coinbase/,+
2023-05-16,Ripple CEO Accuses SEC of Hypocrisy Over Public Statements,"Kraken Exchange Welcomes Pepe. The crypto industry has been seeking more regulatory clarity, particularly in the wake of the SEC's legal action against...",https://u.today/ripple-ceo-accuses-sec-of-hypocrisy-over-public-statements,
2023-06-02,Crypto bill from Republicans lays out clear roles for SEC and CFTC,"The SEC has based several enforcement actions against American crypto entities — including Gemini, Genesis and Kraken ... The crypto exchange received a Wells...",https://www.cnbc.com/2023/06/02/crypto-bill-from-republicans-to-define-roles-of-sec-cftc.html,
2023-05-30,How to Store Cryptocurrency in 2023,"... crypto more quickly, choose either a crypto exchange or hot crypto wallet. ... Coinbase, Binance, and Kraken are all popular examples of cryptocurrency exchanges.",https://www.investopedia.com/how-to-store-cryptocurrency-7500942,
2023-06-08,Coinbase isn’t changing a thing in the wake of the SEC’s lawsuit against it,"Meanwhile, the SEC may be gearing up for more lawsuits against exchanges. According to an analysis by Reuters, Kraken, Gemini, Crypto.com, and OKCoin have all...",https://finance.yahoo.com/news/coinbase-isn-t-changing-thing-163300451.html,+
2023-06-10,This Week in the Metaverse: The Sandbox and Decentraland are caught in the SEC’s crosshairs,Some Fortune Crypto pricing data is provided by Binance. Bitcoin. BTC ... Crypto exchange Kraken launched the final version of its NFT marketplace after months of...,https://fortune.com/crypto/2023/06/10/this-week-in-the-metaverse-the-sandbox-and-decentraland-are-caught-in-secs-crosshairs/,
2023-05-26,No ETH to trade? Ethereum exchange balance drops to a 5 ...,"The first is the collapse of the FTX crypto exchange, prompting many to move their ... Major crypto exchanges like Binance, Bitfinex, Kraken and others that...",https://cointelegraph.com/news/no-eth-to-trade-ethereum-exchange-balance-drops-to-a-5-year-low,
2023-06-10,"Crypto hiring: Binance, Circle make key hires amid SEC ...","Kraken CEO David Ripley, who took the helm at the crypto exchange in late April this year, said Patankar is a leader in the field that is “well equipped to...",https://blockworks.co/news/binance-circle-make-key-hires,
2023-05-26,Stablecoins Are the 'Glue' Between the Real Economy and Blockchain: Binance Japan General Manager,... cryptocurrencies like bitcoin (BTC). Rival crypto exchanges Coinbase (COIN) and Kraken have both withdrawn from the Japanese market in the last six months...,https://www.coindesk.com/business/2023/05/26/stablecoins-are-the-glue-between-the-real-economy-and-blockchain-binance-japan-general-manager/,+
2023-06-01,eToro vs Kraken - Which Exchange Is Better for Crypto?,"eToro vs Kraken. Supported Crypto. When it comes to the cryptocurrencies an exchange supports, it is pretty beneficial for a platform to support multiple coins...",https://coindoo.com/etoro-vs-kraken/,
2023-05-20,Pepe Price - New Rally? Traders Bullish on $COPIUM And ...,"After Binance, several other platforms such as Ledger, Kraken Exchange, Gemini, etc. are listing the token. Furthermore, LayerZero Lab has developed a new...",https://beincrypto.com/pepe-price-new-rally-traders-bullish-on-copium-and-aidoge/,
2023-05-29,Cryptocurrency market struggles with transparency,"“When we are commissioned to review a crypto exchange or custodian, often the first ... Cryptocurrency exchanges: Binance, Coinbase, Kraken, KuCoin, Bitstamp...",https://www.ft.com/content/85184cf9-79d2-4080-b817-4ea6f0cc9846,
2023-06-09,Cathie Wood's ARK Invest fund bets more on Coinbase ...,"... exchanges) over the last year or so.""Other SEC enforcement actions against crypto companies — like California-based exchange Kraken, which paid $30 million...",https://www.pionline.com/cryptocurrency/cathie-woods-ark-invest-fund-bets-more-coinbase-despite-sec-crackdown,
2023-05-13,Quantura Launches Automated Crypto Trading Platform for Diverse Trading Needs,"In addition, it is compatible with popular exchanges like Kraken, Crypto.com, and Binance, allowing users to manage their exchange wallets from a single...",https://finance.yahoo.com/news/quantura-launches-automated-crypto-trading-230500814.html,
2023-05-29,Winklevoss Twins' Gemini Crypto Exchange Pivots After ...,"And it compares unfavorably with many of Gemini's rivals including Coinbase and Kraken, which each saw their market share increase in April from a year earlier,...",https://www.bloomberg.com/news/articles/2023-05-29/winklevoss-twins-gemini-crypto-exchange-pivots-after-layoffs-losses-earn,
2023-05-21,What is the Current Status of the Ripple Lawsuit?,"... Exchange Commission (SEC) has captivated the global crypto community. This ... Given that now Coinbase, Kraken, Bittrex, TRON, and dozens of others have...",https://beincrypto.com/ripple-lawsuit-update-recent-developments/,
2023-06-06,SEC sues Coinbase for violating securities rules,"... crypto exchanges. In February, SEC fined U.S. crypto exchange Kraken and shut its crypto staking program. In April, the SEC charged Seattle-based crypto...",https://forkast.news/sec-sues-coinbase-for-violating-rules/,
